{
  "project_id": "PRJ-007",
  "story_seed_hash": "eccc405ce79422d8532da52d6e8e8453ac2a8fdd95ffd365142ae6d9b1b31a99",
  "variation_engine_version": "2.1.0",
  "variation_catalog_version": "2.1.0",
  "catalog_sha256": "f2a033372d6d589748ea87fe7ec984be00e1710f56a1a40547a9eb2988cac683",
  "algorithm_sha256": "7274292e3a44bddb2ef8038d57e80a3bbb8abba0c8a667aeafcd3a7474beb5f6",
  "implementation_sha256": "06533fe8f4dc1106f8e4df0b9f8fe7b7caabc6169318dfd0c76ca6b56b1699d6",
  "candidate_count": 5,
  "candidates": [
    {
      "candidate_id": "VAR-01",
      "origin_batch_id": "BATCH-01",
      "batch_candidate_id": "BVAR-01",
      "variation_engine_version": "2.1.0",
      "variation_catalog_version": "2.1.0",
      "catalog_sha256": "f2a033372d6d589748ea87fe7ec984be00e1710f56a1a40547a9eb2988cac683",
      "algorithm_sha256": "7274292e3a44bddb2ef8038d57e80a3bbb8abba0c8a667aeafcd3a7474beb5f6",
      "implementation_sha256": "06533fe8f4dc1106f8e4df0b9f8fe7b7caabc6169318dfd0c76ca6b56b1699d6",
      "selection": {
        "primary_crime": "MURDER",
        "core_action_type": "MURDER",
        "responsible_agent_structure": "DUAL_AGENTS",
        "victim_structure": "SINGLE_VICTIM",
        "relationship_context": "NEIGHBOR",
        "harm_classification": "FATALITY",
        "motive_category": "CONTROL",
        "protagonist_role": "VICTIM_FAMILY",
        "protagonist_goal": "PROTECT_TARGET",
        "protagonist_risk": "PHYSICAL_HARM",
        "depiction_mode": "IMPLIED",
        "reveal_structure": "WITNESS_RECONSTRUCTION",
        "architecture": "ARCH-04_REVERSE_CAUSE",
        "child_actor_use": "NONE",
        "clue_mechanism": "PHYSICAL_OBJECT",
        "dramatic_engine": "WITNESS_DILEMMA",
        "final_proof_mechanism": "WITNESS_AND_PHYSICAL_CORROBORATION",
        "genre": "CRIME_EVENT_THRILLER",
        "graphic_violence": "IMPLIED",
        "information_mechanism": "RELATIONAL_DISCLOSURE",
        "location_count": "LOCATIONS_5",
        "major_character_count": "MAJOR_7",
        "mystery_type": "WHY",
        "perspective": "INTERVIEW_BASED",
        "pressure_engine": "ONGOING_THREAT",
        "primary_twist": "TW-02_WITNESS_ACCOUNT_CORRECTED",
        "production_complexity": "HIGH",
        "relationship_engine": "PROTECTIVE_CONFLICT",
        "reveal_mode": "RESPONSIBILITY_CONFIRMATION",
        "setting": "WORKPLACE",
        "special_effect_level": "MEDIUM",
        "technical_dependency_level": "HIGH",
        "timeline_style": "FLASHBACK_DRIVEN",
        "vehicle_scene": "NONE"
      },
      "policy_profile": {
        "genre": "CRIME_EVENT_THRILLER",
        "threat_type": "CRIME",
        "incident_type": "MURDER",
        "culprit_structure": "DUAL",
        "trusted_domain": "NEIGHBOR",
        "safe_domain_betrayal": "PHYSICAL_BOUNDARY_VIOLATED",
        "responsible_agent_structure": "DUAL_AGENTS",
        "information_mechanism": "RELATIONAL_DISCLOSURE",
        "clue_mechanism": "PHYSICAL_OBJECT",
        "reveal_mode": "RESPONSIBILITY_CONFIRMATION",
        "final_proof_mechanism": "WITNESS_AND_PHYSICAL_CORROBORATION",
        "victim_agency_mode": "SURVIVOR_DECISION",
        "primary_twist": "TW-02_WITNESS_ACCOUNT_CORRECTED",
        "pressure_engine": "ONGOING_THREAT",
        "technical_dependency_level": "HIGH",
        "production_complexity": "HIGH",
        "location_count": "LOCATIONS_5",
        "major_character_count": "MAJOR_7",
        "special_effect_level": "MEDIUM",
        "child_actor_use": "NONE",
        "vehicle_scene": "NONE",
        "graphic_violence": "IMPLIED",
        "episode_theme": "OFFENDER_RESPONSIBILITY",
        "source_truth_classification": "ORIGINAL_FICTION"
      },
      "signature": "a81493e76c3a122c1e0b1216451d03b8dca80aea5a9615ece6ca4959c325d644",
      "selection_status": "REJECTED"
    },
    {
      "candidate_id": "VAR-02",
      "origin_batch_id": "BATCH-01",
      "batch_candidate_id": "BVAR-02",
      "variation_engine_version": "2.1.0",
      "variation_catalog_version": "2.1.0",
      "catalog_sha256": "f2a033372d6d589748ea87fe7ec984be00e1710f56a1a40547a9eb2988cac683",
      "algorithm_sha256": "7274292e3a44bddb2ef8038d57e80a3bbb8abba0c8a667aeafcd3a7474beb5f6",
      "implementation_sha256": "06533fe8f4dc1106f8e4df0b9f8fe7b7caabc6169318dfd0c76ca6b56b1699d6",
      "selection": {
        "primary_crime": "KIDNAPPING",
        "core_action_type": "KIDNAPPING",
        "responsible_agent_structure": "SINGLE_AGENT",
        "victim_structure": "MULTIPLE_VICTIMS",
        "relationship_context": "FAMILY_OR_HOUSEHOLD",
        "harm_classification": "LIBERTY_DEPRIVATION",
        "motive_category": "CONCEALMENT",
        "protagonist_role": "UNWITTING_PARTICIPANT",
        "protagonist_goal": "ESTABLISH_EVENT_TRUTH",
        "protagonist_risk": "ONGOING_ACCESS",
        "depiction_mode": "AFTERMATH_CAUSAL",
        "reveal_structure": "OUTCOME_THEN_RESPONSIBILITY",
        "architecture": "ARCH-05_BELIEF_COLLAPSE",
        "child_actor_use": "NONE",
        "clue_mechanism": "DOCUMENTARY",
        "dramatic_engine": "RESPONSIBILITY_REVEAL",
        "final_proof_mechanism": "INDEPENDENT_NONTECHNICAL_GROUNDS",
        "genre": "CRIME_EVENT_THRILLER",
        "graphic_violence": "NON_GRAPHIC",
        "information_mechanism": "WITNESS_ACCOUNT",
        "location_count": "LOCATIONS_3",
        "major_character_count": "MAJOR_4",
        "mystery_type": "HOW",
        "perspective": "MULTIPLE_POV",
        "pressure_engine": "EVIDENCE_DECAY",
        "primary_twist": "TW-01_OFFENDER_ACCESS_REFRAMED",
        "production_complexity": "MEDIUM",
        "relationship_engine": "ACCESS_AND_BOUNDARY",
        "reveal_mode": "OFFENDER_IDENTIFICATION",
        "setting": "HOUSE",
        "special_effect_level": "NONE",
        "technical_dependency_level": "LOW",
        "timeline_style": "DUAL_TIMELINE",
        "vehicle_scene": "NONE"
      },
      "policy_profile": {
        "genre": "CRIME_EVENT_THRILLER",
        "threat_type": "CRIME",
        "incident_type": "KIDNAPPING",
        "culprit_structure": "SINGLE",
        "trusted_domain": "FAMILY",
        "safe_domain_betrayal": "PHYSICAL_BOUNDARY_VIOLATED",
        "responsible_agent_structure": "SINGLE_AGENT",
        "information_mechanism": "WITNESS_ACCOUNT",
        "clue_mechanism": "DOCUMENTARY",
        "reveal_mode": "OFFENDER_IDENTIFICATION",
        "final_proof_mechanism": "INDEPENDENT_NONTECHNICAL_GROUNDS",
        "victim_agency_mode": "SURVIVOR_DECISION",
        "primary_twist": "TW-01_OFFENDER_ACCESS_REFRAMED",
        "pressure_engine": "EVIDENCE_DECAY",
        "technical_dependency_level": "LOW",
        "production_complexity": "MEDIUM",
        "location_count": "LOCATIONS_3",
        "major_character_count": "MAJOR_4",
        "special_effect_level": "NONE",
        "child_actor_use": "NONE",
        "vehicle_scene": "NONE",
        "graphic_violence": "NON_GRAPHIC",
        "episode_theme": "OFFENDER_RESPONSIBILITY",
        "source_truth_classification": "ORIGINAL_FICTION"
      },
      "signature": "6743ed89929190cc88d8e23cecccb571e039d02dc7a6f77c1fb983206df2b01a",
      "selection_status": "REJECTED"
    },
    {
      "candidate_id": "VAR-03",
      "origin_batch_id": "BATCH-01",
      "batch_candidate_id": "BVAR-03",
      "variation_engine_version": "2.1.0",
      "variation_catalog_version": "2.1.0",
      "catalog_sha256": "f2a033372d6d589748ea87fe7ec984be00e1710f56a1a40547a9eb2988cac683",
      "algorithm_sha256": "7274292e3a44bddb2ef8038d57e80a3bbb8abba0c8a667aeafcd3a7474beb5f6",
      "implementation_sha256": "06533fe8f4dc1106f8e4df0b9f8fe7b7caabc6169318dfd0c76ca6b56b1699d6",
      "selection": {
        "primary_crime": "CONFINEMENT",
        "core_action_type": "CONFINEMENT",
        "responsible_agent_structure": "COMPLICIT_GROUP",
        "victim_structure": "SINGLE_VICTIM",
        "relationship_context": "DATING_PARTNER",
        "harm_classification": "LIBERTY_DEPRIVATION",
        "motive_category": "RETALIATION",
        "protagonist_role": "VICTIM",
        "protagonist_goal": "SURVIVE_OR_ESCAPE",
        "protagonist_risk": "HOUSEHOLD_DANGER",
        "depiction_mode": "DIRECT_NON_GRAPHIC",
        "reveal_structure": "CULPRIT_MOTIVE_METHOD_OUTCOME",
        "architecture": "ARCH-01_LINEAR_REVEAL",
        "child_actor_use": "NONE",
        "clue_mechanism": "RELATIONAL",
        "dramatic_engine": "SAFETY_COLLAPSE",
        "final_proof_mechanism": "CLAIM_EVIDENCE_CHAIN",
        "genre": "CRIME_EVENT_THRILLER",
        "graphic_violence": "NONE",
        "information_mechanism": "PHYSICAL_EVIDENCE_CHAIN",
        "location_count": "LOCATIONS_2",
        "major_character_count": "MAJOR_5",
        "mystery_type": "WHAT",
        "perspective": "THIRD_PERSON_LIMITED",
        "pressure_engine": "RETALIATION_RISK",
        "primary_twist": "TW-04_RESPONSIBILITY_CONFIRMED",
        "production_complexity": "LOW",
        "relationship_engine": "BROKEN_TRUST",
        "reveal_mode": "MOTIVE_DISCLOSURE",
        "setting": "APARTMENT",
        "special_effect_level": "LOW",
        "technical_dependency_level": "MEDIUM",
        "timeline_style": "FRAGMENTED",
        "vehicle_scene": "NONE"
      },
      "policy_profile": {
        "genre": "CRIME_EVENT_THRILLER",
        "threat_type": "CRIME",
        "incident_type": "CONFINEMENT",
        "culprit_structure": "MULTIPLE",
        "trusted_domain": "ROMANTIC_PARTNER",
        "safe_domain_betrayal": "PHYSICAL_BOUNDARY_VIOLATED",
        "responsible_agent_structure": "COMPLICIT_GROUP",
        "information_mechanism": "PHYSICAL_EVIDENCE_CHAIN",
        "clue_mechanism": "RELATIONAL",
        "reveal_mode": "MOTIVE_DISCLOSURE",
        "final_proof_mechanism": "CLAIM_EVIDENCE_CHAIN",
        "victim_agency_mode": "SURVIVOR_DECISION",
        "primary_twist": "TW-04_RESPONSIBILITY_CONFIRMED",
        "pressure_engine": "RETALIATION_RISK",
        "technical_dependency_level": "MEDIUM",